,date,title,description,source
0,2025-09-28,"Apple Revamps AI Strategy, Emphasizing Chatbots and Overhauling Siri","In a significant shift in its artificial intelligence (AI) strategy, Apple Inc. (NASDAQ: AAPL) is reportedly prioritizing chatbot-like experiences and overhauling its Siri voice assistant.
Bloomberg's Mark Gurman, in his latest ""Power On” report revealed that…",newsapi
1,2025-09-28,Cathie Wood sells $22.3 million of popular tech stock,Here are Cathie Wood’s latest moves.,newsapi
2,2025-09-28,Watch out: Soaring stocks could tip markets over,The major averages are sitting just below all-time highs as September closes.,newsapi
3,2025-09-28,Americans have more money in stocks than ever before. Economists say that’s a bright red flag | CNN Business,"Americans have more money in stocks than ever before. But while the market’s climb may be inflating their accounts, they are more exposed than ever to a potential market slump.",newsapi
4,2025-09-28,Fed Rate Cuts: Implications For Berkshire Hathaway’s Stock And Profits,"Discover how Fed rate cuts and housing trends are reshaping Berkshire Hathaway’s cash, profits, and stock outlook for investors.",newsapi
5,2025-09-28,"Weekly Market Wrap: Apple up, Electronic Arts soars, and Intel resurfaces",Here is what you need to know about the stock market this past week.,newsapi
6,2025-09-27,"You Won’t Believe the Top 5 Robinhood Stock Beating AAPL, MSFT, and TSLA in 2025","Key Points
 
 
 
 
 
 
Robinhood’s top 10 holdings feature six Magnificent Seven stocks, reflecting retail investors’ tech focus.
 
 
 
 
Everyday traders on digital platforms are driving market trends with significant influence.
 
 
 
 
A non-tech stock at N…",newsapi
7,2025-09-27,Apple (AAPL) Has Built a ‘ChatGPT-Like’ App to Test New Features - TipRanks,Apple (AAPL) Has Built a ‘ChatGPT-Like’ App to Test New FeaturesTipRanks Apple Builds a ChatGPT-Like App to Help Test the Revamped SiriBloomberg.com Report: Apple Has Developed an Internal ChatGPT-Like Tool for Testing Siri FeaturesCNET Apple now has an AI ap…,newsapi
8,2025-09-27,Zacks Research Issues Optimistic Outlook for Apple Earnings,"Apple Inc. (NASDAQ:AAPL – Free Report) – Stock analysts at Zacks Research upped their Q3 2027 earnings estimates for shares of Apple in a note issued to investors on Tuesday, September 23rd. Zacks Research analyst Team now anticipates that the iPhone maker wi…",newsapi
9,2025-09-27,Technology Stocks To Follow Now – September 25th,"NVIDIA, Palantir Technologies, Oracle, Intel, and Apple are the five Technology stocks to watch today, according to MarketBeat’s stock screener tool. Technology stocks are shares of companies whose primary business involves the development, manufacturing or d…",newsapi
10,2025-09-27,Apple、macOS 26 Tahoeに対応したUI KitテンプレートやSF Symbols、Icon Composerをマイナーアップデート。,"AppleがmacOS 26 Tahoeに対応したUI KitテンプレートやSF Symbols、Icon Composerをマイナーアップデートしています。詳細は以下から。 　Appleは2025年06月に開催したW […]
The post Apple、macOS 26 Tahoeに対応したUI KitテンプレートやSF Symbols、Icon Composerをマイナーアップデート。 first appeared on AAPL Ch..",newsapi
11,2025-09-26,"Apple (AAPL) Stock: UBS Reiterates Neutral, $220 PT on iPhone 17 Availability Data",,newsapi
12,2025-09-26,Kevin O’Leary is furious at Trump ‘force-feeding’ him Intel — as the US aims to invest taxpayer money in another company,"“I don’t like governments picking winners and losers,” Mr. Wonderful says.",newsapi
13,2025-09-26,I inherited $600K in Apple stock. It now makes up 50% of my portfolio. Is that too risky?,"“I worry that a downturn in the tech sector, or something Apple-specific, could wipe out half my portfolio.”",newsapi
14,2025-09-26,S&P 500 Gains and Losses Today: Electronic Arts Stock Pops on Buyout Talks; Costco Slips,"Shares of a video game maker surged on Friday, Sept. 26, 2025, as reports emerged about a possible takeover, while a big-box warehouse player stumbled after ...",newsapi
15,2025-09-26,His Peers Have Debt and Job Anxiety. He Has a Nearly Six-Figure Business And Zero Loans.,"While many of his peers juggle student loan debt and uncertain job prospects, 23-year-old Jacob Palmer of Concord, North Carolina, is debt-free and running a...",newsapi
16,2025-09-26,"Carrier Incentives Could Spike Apple iPhone 17 Sales, Says Analyst","Richer U.S. carrier trade-in deals and extended 24- to 36-month financing plans are giving Apple Inc. (NASDAQ: AAPL) a boost in this year’s iPhone upgrade cycle.
Carriers are offering around $100 more in subsidies for new iPhones this year, which could result…",newsapi
17,2025-09-26,"Carrier Incentives Could Spike Apple iPhone 17 Sales, Says Analyst",Richer U.S. carrier trade-in deals and extended 24- to 36-month financing plans are giving Apple Inc. (NASDAQ: AAPL) a boost in this year’s iPhone upgrade...,newsapi
18,2025-09-26,"Can the S&P Hit 7,000 By Year-End? 2 Stocks That Could Lead the Way","Key Points
 
 
 
 
 
 
The S&P may be ready to move past 7,000, according to some pundits.
 
 
 
 
AAPL and NVDA could be the stocks to help the S&P hit the major milestone by year’s end.
 
 
 
 
Are you ahead, or behind on retirement? SmartAsset’s free tool …",newsapi
19,2025-09-26,"Comparing Apple With Industry Competitors In Technology Hardware, Storage & Peripherals Industry","In today's rapidly evolving and fiercely competitive business landscape, it is crucial for investors and industry analysts to conduct comprehensive company evaluations. In this article, we will undertake an in-depth industry comparison, assessing Apple (NASDA…",newsapi
20,2025-09-26,"Tigress Financial Raises PT on Apple from $300 to $305, Keeps Buy Rating on the Stock","Apple Inc. (NASDAQ:AAPL) is one of the 10 Best AI Stocks to Buy According to Goldman Sachs. On September 17, Tigress Financial raised the price target on...",newsapi
21,2025-09-26,"Stock Market Today: Dow Rallies On Fed Inflation Data; Apple, Costco Fall (Live Coverage)","The Dow Jones Industrial Average and the other major stock indexes rose Friday as Wall Street reacted to the Federal Reserve's favored inflation gauge, the core PCE price index. Meanwhile, Apple (AAPL) and Costco Wholesale (COST) were early losers on the stoc…",newsapi
22,2025-09-26,"Jim Cramer Points To 1,000-Person Tokyo Apple Store Line As Proof Of Why AAPL Stock Keeps Defying Doubters: Tim Cook Hails 'New Chapter'","Jim Cramer, the host of CNBC’s “Mad Money,” lauded the reopening of the Apple Inc. (NASDAQ: AAPL) store in Tokyo, Japan, and hinted at the stock’s robust performance.
Cramer shared a post on X on Wednesday, highlighting the significance of the Tokyo Apple Sto…",newsapi
23,2025-09-26,Is Your New iPhone Made With Mistreated Workers?,"Apple Inc. (NASDAQ: AAPL) is investigating labor conditions at Foxconn’s Zhengzhou facility following new allegations by China Labor Watch (CLW) of persistent worker mistreatment.
The company said its teams were already on-site and reiterated its commitment t…",newsapi
24,2025-09-26,Intel's comeback is fueled by the promise of more deals,Investors are flocking toward a succession of monumental deals and the potential for more to come.,newsapi
25,2025-09-26,"Xiaomi's New 17 Series May Resemble iPhone 17, Yet Packs Bold Tricks That Might Win Over Even Hardcore Apple Loyalists","On Thursday, Xiaomi (OTC: XIACY) (OTC: XIACF) unveiled its 17 Series in China, positioning the lineup against Apple Inc.'s (NASDAQ: AAPL) iPhone 17, but with bold extras like secondary displays, massive batteries and competitive pricing designed to impress ev…",newsapi
26,2025-09-26,WindowsとLinux仮想マシンとの互換性を向上させた「Parallels Desktop 26 for Mac v26.1.0」がリリース。,"WindowsとLinux仮想マシンとの互換性を向上させた「Parallels Desktop 26 for Mac v26.1.0」がリリースされています。詳細は以下から。 　Alludo(旧Corel)傘下のPar […]
The post WindowsとLinux仮想マシンとの互換性を向上させた「Parallels Desktop 26 for Mac v26.1.0」がリリース。 first appeared on AAPL Ch..",newsapi
27,2025-09-26,Apple (AAPL) Sees High Demand for Affordable iPhone 17,"Apple Inc. (NASDAQ:AAPL) is one of the 15 Best American Tech Stocks to Buy Right Now. On September 19, Reuters reported that Apple Inc. (NASDAQ:AAPL) has...",newsapi
28,2025-09-26,Apple (AAPL) Stock Target Lifted to $280 as Analysts See Upside in iPhone 17 Cycle,"Apple Inc. (NASDAQ:AAPL) is one of the Buzzing AI Stocks on Wall Street. On September 19, JPMorgan reiterated the stock as “Overweight” and raised its price ...",newsapi
29,2025-09-25,"S&P 500 Gains & Losses Today: CarMax Stock Skids, Oracle Retreats; Intel Pushes Higher","A major auto seller's stock plummeted on Thursday, Sept. 25, 2025, while a semiconductor giant got a boost from reported talks with a top tech firm.",newsapi
30,2025-09-25,"$20,000 invested in the Betashares Nasdaq 100 ETF (NDQ) 5 years ago is now worth","Let's see what would have happened if you had bought this popular fund five years ago.
The post $20,000 invested in the Betashares Nasdaq 100 ETF (NDQ) 5 years ago is now worth appeared first on The Motley Fool Australia.",newsapi
31,2025-09-25,Stocks fall for the third day in a row. Is this the start of a deeper pullback?,"A week after the Federal Reserve resumed rate cuts after a nine-month pause, stocks reversed their uptrend with a three-day losing streak, leaving investors ...",newsapi
32,2025-09-25,"Stock market today: Dow, S&P 500, Nasdaq slide for 3rd day as Wall Street slump continues",Fresh jobs data could reset interest-rate bets amid uncertainty about Federal Reserve unity on policy.,newsapi
33,2025-09-25,macOS 26 Tahoeインストーラーのダウンロードに対応した「Mist v0.30」がリリース。,"macOS 26 Tahoeインストーラーのダウンロードに対応した「Mist v0.30」がリリースされています。詳細は以下から。 　Mist(MacOS Installer Super Tool)はDropboxエン […]
The post macOS 26 Tahoeインストーラーのダウンロードに対応した「Mist v0.30」がリリース。 first appeared on AAPL Ch..",newsapi
34,2025-09-25,Intel 'needs' Apple to invest like Nvidia & US government did,"Intel (INTC) is reportedly working to secure an investment from Apple (AAPL), just after securing investments from Nvidia (NVDA) and the US government. D.A. ...",newsapi
35,2025-09-25,"As Intel Pops on Potential Apple Stake, Options Data Tells Us INTC Stock Could Be Headed Here Next",Intel stock rallies further on reports the chipmaker has approached Apple for a strategic investment. But it may not be the lifeline that INTC shares so...,newsapi
36,2025-09-25,"Jim Cramer on Apple: “I Say Over and Over, Should Not Be Traded, Just Owned”","Apple Inc. (NASDAQ:AAPL) is one of the stocks Jim Cramer shared his opinions on. Cramer reiterated that the stock should “not be traded, just owned.” He...",newsapi
37,2025-09-25,"Top Stock Movers Now: Intel, IBM, Oracle, Lithium Americas, and More","Major U.S. equities indexes lost ground in recent trading, in a third straight day of losses.",newsapi
38,2025-09-25,"Insights Into Apple's Performance Versus Peers In Technology Hardware, Storage & Peripherals Sector","Amidst today's fast-paced and highly competitive business environment, it is crucial for investors and industry enthusiasts to conduct comprehensive company evaluations. In this article, we will delve into an extensive industry comparison, evaluating Apple (N…",newsapi
39,2025-09-25,Analyst Explains Why Apple (AAPL) Will Struggle to Maintain Its Customer Base – ‘They’ve Gone On The Defense’,"Analyst Explains Why Apple (AAPL) Will Struggle to Maintain Its Customer Base – ‘They’ve Gone On The Defense’
We recently published Trending Analyst Calls: Top 10 Stocks. Apple Inc. (NASDAQ:AAPL) is one of the stocks analysts were recently talking about.
Laur…",newsapi
40,2025-09-25,Analyst Explains Why Apple (AAPL) Will Struggle to Maintain Its Customer Base – ‘They’ve Gone On The Defense’,We recently published Trending Analyst Calls: Top 10 Stocks. Apple Inc. (NASDAQ:AAPL) is one of the stocks analysts were recently talking about. Laura Martin...,newsapi
41,2025-09-25,What's Going On With Intel Stock Today?,"Intel Corp (NASDAQ: INTC) shares are trading higher Thursday following reports that the company is seeking an investment from Apple Inc (NASDAQ: AAPL) as part of a comeback bid. 
What To Know: Intel is in early-stage talks with Apple about making an investmen…",newsapi
42,2025-09-25,5 Things to Know Before the Stock Market Opens,Stock futures are lower after two straight days of declines for major indexes as investors await key economic data; Costco Wholesale (COST) is scheduled to report earnings after the closing bell; Intel (INTC) shares are rising on a report it is seeking an inv…,newsapi
43,2025-09-25,"US stock market futures today: Dow, S&P 500 & Nasdaq slips ahead of jobless data and Fed policy signals",US stock market futures today September 25: US stocks traded cautiously as investors awaited jobless claims data to assess the Federal Reserve's next move on interest rates. Concerns about AI valuations and tempered rate cut optimism contributed to market coo…,newsapi
44,2025-09-25,5 Things to Know Before the Stock Market Opens,"News of the day for Sept. 25, 2025",newsapi
45,2025-09-25,Defined Wealth Management LLC Buys 223 Shares of Apple Inc. $AAPL,"Defined Wealth Management LLC lifted its stake in Apple Inc. (NASDAQ:AAPL – Free Report) by 2.0% in the 2nd quarter, according to the company in its most recent 13F filing with the Securities and Exchange Commission. The firm owned 11,575 shares of the iPhone…",newsapi
46,2025-09-25,Praetorian Wealth Management Inc. Has $3.52 Million Holdings in Apple Inc. $AAPL,"Praetorian Wealth Management Inc. lessened its position in shares of Apple Inc. (NASDAQ:AAPL – Free Report) by 0.9% in the second quarter, according to the company in its most recent 13F filing with the Securities and Exchange Commission. The firm owned 17,14…",newsapi
47,2025-09-25,Best Large Cap Stocks To Watch Today – September 23rd,"Tesla, Invesco QQQ, NVIDIA, Amazon.com, and Apple are the five Large Cap stocks to watch today, according to MarketBeat’s stock screener tool. Large-cap stocks are shares of companies with a market capitalization usually exceeding $10 billion. These firms ten…",newsapi
48,2025-09-25,Chesley Taft & Associates LLC Has $57.92 Million Position in Apple Inc. $AAPL,"Chesley Taft & Associates LLC reduced its holdings in Apple Inc. (NASDAQ:AAPL – Free Report) by 5.9% in the 2nd quarter, Holdings Channel reports. The fund owned 282,298 shares of the iPhone maker’s stock after selling 17,549 shares during the quarter. Apple …",newsapi
49,2025-09-25,"Stokes Capital Advisors LLC Sells 2,928 Shares of Apple Inc. $AAPL","Stokes Capital Advisors LLC trimmed its stake in Apple Inc. (NASDAQ:AAPL – Free Report) by 6.1% in the second quarter, according to its most recent Form 13F filing with the Securities and Exchange Commission. The firm owned 45,186 shares of the iPhone maker’s…",newsapi
50,2025-09-25,"Pallas Capital Advisors LLC Sells 9,396 Shares of Apple Inc. $AAPL","Pallas Capital Advisors LLC reduced its stake in Apple Inc. (NASDAQ:AAPL – Free Report) by 3.6% during the second quarter, Holdings Channel.com reports. The fund owned 252,484 shares of the iPhone maker’s stock after selling 9,396 shares during the period. Ap…",newsapi
51,2025-09-25,Pines Wealth Management LLC Increases Position in Apple Inc. $AAPL,"Pines Wealth Management LLC boosted its stake in Apple Inc. (NASDAQ:AAPL – Free Report) by 6.7% during the second quarter, according to its most recent filing with the Securities and Exchange Commission (SEC). The firm owned 41,744 shares of the iPhone maker’…",newsapi
52,2025-09-25,Apple Inc. $AAPL is Affinity Capital Advisors LLC’s 5th Largest Position,"Affinity Capital Advisors LLC reduced its stake in Apple Inc. (NASDAQ:AAPL – Free Report) by 6.5% in the 2nd quarter, according to the company in its most recent filing with the Securities & Exchange Commission. The institutional investor owned 154,453 shares…",newsapi
53,2025-09-25,Tounjian Advisory Partners LLC Lowers Stake in Apple Inc. $AAPL,"Tounjian Advisory Partners LLC lowered its holdings in Apple Inc. (NASDAQ:AAPL – Free Report) by 1.8% during the second quarter, HoldingsChannel.com reports. The fund owned 113,598 shares of the iPhone maker’s stock after selling 2,120 shares during the perio…",newsapi
54,2025-09-25,Why these ASX ETFs could power long-term wealth,"Let's see what makes these funds standout picks for Aussie investors.
The post Why these ASX ETFs could power long-term wealth appeared first on The Motley Fool Australia.",newsapi
55,2025-09-25,Archer Investment Management LLC Lowers Stake in Apple Inc. $AAPL,"Archer Investment Management LLC decreased its position in Apple Inc. (NASDAQ:AAPL – Free Report) by 25.3% during the second quarter, Holdings Channel reports. The firm owned 4,182 shares of the iPhone maker’s stock after selling 1,420 shares during the quart…",newsapi
56,2025-09-25,"Gilman Hill Asset Management LLC Acquires 3,144 Shares of Apple Inc. $AAPL","Gilman Hill Asset Management LLC boosted its holdings in shares of Apple Inc. (NASDAQ:AAPL – Free Report) by 18.1% during the 2nd quarter, according to the company in its most recent disclosure with the SEC. The institutional investor owned 20,523 shares of t…",newsapi
57,2025-09-25,Lincoln Capital Corp Cuts Stake in Apple Inc. $AAPL,"Lincoln Capital Corp decreased its position in Apple Inc. (NASDAQ:AAPL – Free Report) by 6.7% during the second quarter, Holdings Channel.com reports. The fund owned 55,249 shares of the iPhone maker’s stock after selling 3,945 shares during the quarter. Appl…",newsapi
58,2025-09-25,Best Technology Stocks To Consider – September 23rd,"NVIDIA, Apple, Oracle, Palantir Technologies, Advanced Micro Devices, Microsoft, and Alphabet are the seven Technology stocks to watch today, according to MarketBeat’s stock screener tool. Technology stocks are shares of publicly traded companies whose primar…",newsapi
59,2025-09-25,Zacks Research Analysts Reduce Earnings Estimates for Apple,"Apple Inc. (NASDAQ:AAPL – Free Report) – Zacks Research decreased their Q3 2026 earnings per share estimates for Apple in a report released on Tuesday, September 23rd. Zacks Research analyst Team now forecasts that the iPhone maker will post earnings per shar…",newsapi
60,2025-09-24,"Stock market today: Dow, S&P 500, Nasdaq fall amid sharp GDP expansion, jobless claims dip",Fresh jobs data could reset interest-rate bets amid uncertainty about Federal Reserve unity on policy.,newsapi
61,2025-09-24,"Stock market today: Dow, S&P 500, Nasdaq futures fall after back-to-back losses, jobless claims dip",Fresh jobs data could reset interest-rate bets amid uncertainty about Federal Reserve unity on policy.,newsapi
62,2025-09-24,"Stock market today: Dow, S&P 500, Nasdaq fall after back-to-back losses, jobless claims dip",Fresh jobs data could reset interest-rate bets amid uncertainty about Federal Reserve unity on policy.,newsapi
63,2025-09-24,"S&P 500 Gains & Losses Today: Intel Stock Extends Rally, Freeport-McMoRan Drops","A softening sales forecast pressured shares of a copper and gold miner on Wednesday, Sept. 24, 2025, while a brightening outlook for PCs and servers helped a...",newsapi
64,2025-09-24,"How ‘Bout Them Apples? As AAPL Stock Flies, This Option Strategy Can Help You Squeeze Out Even More Juice",,newsapi
65,2025-09-24,"How ‘Bout Them Apples? As AAPL Stock Flies, This Option Strategy Can Help You Squeeze Out Even More Juice.","With Apple trading near all-time highs, investors can protect themselves from downside with these strategies.",newsapi
66,2025-09-24,"AI startup Modular raises $250 million, seeks to challenge Nvidia dominance","(Reuters) -AI startup Modular said on Wednesday it raised $250 million in a funding round valuing it at $1.6 billion, as it aims to challenge Nvidia's...",newsapi
67,2025-09-24,"Comparing Apple With Industry Competitors In Technology Hardware, Storage & Peripherals Industry","In today's rapidly changing and highly competitive business world, it is imperative for investors and industry observers to carefully assess companies before making investment choices. In this article, we will undertake a comprehensive industry comparison, ev…",newsapi
68,2025-09-24,UBS Reaffirms Price Target on Apple (AAPL) After Mixed iPhone 17 Preorder Data,"Apple Inc. (NASDAQ:AAPL) ranks among the hot stocks to invest in right now. On September 17, UBS reaffirmed its $220 price target and Neutral rating on Apple Inc. (NASDAQ:AAPL) after analyzing early iPhone 17 preorder data. According to analyst David Vogt, UB…",newsapi
69,2025-09-24,UBS Reaffirms Price Target on Apple (AAPL) After Mixed iPhone 17 Preorder Data,"Apple Inc. (NASDAQ:AAPL) ranks among the hot stocks to invest in right now. On September 17, UBS reaffirmed its $220 price target and Neutral rating on Apple...",newsapi
70,2025-09-24,Top Funds Launch This Next-Gen Mobility Stock Into Orbit. Here's What's Fueling Demand.,"As Palantir and Amazon target buy zones, strong demand from top funds have Jabil stock testing a breakout with earnings due.",newsapi
71,2025-09-24,Bull Call Spread Screener Results For September 24th,With back in bullish mode it’s a good time to run Barchart’s Bull Call Spread Screener. A bull call spread is an options strategy that a trader uses when...,newsapi
72,2025-09-24,Top Large Cap Stocks To Add to Your Watchlist – September 22nd,"NVIDIA, Tesla, Invesco QQQ, Apple, and Oracle are the five Large Cap stocks to watch today, according to MarketBeat’s stock screener tool. Large-cap stocks are shares of well-established companies with market capitalizations generally exceeding $10 billion, c…",newsapi
73,2025-09-24,Breakwater Capital Group Has $18 Million Stock Position in Apple Inc. $AAPL,"Breakwater Capital Group cut its position in shares of Apple Inc. (NASDAQ:AAPL – Free Report) by 0.2% during the second quarter, HoldingsChannel.com reports. The firm owned 87,734 shares of the iPhone maker’s stock after selling 139 shares during the period. …",newsapi
74,2025-09-24,Apple Inc. $AAPL Shares Sold by Baron Wealth Management LLC,"Baron Wealth Management LLC reduced its holdings in shares of Apple Inc. (NASDAQ:AAPL – Free Report) by 2.7% in the second quarter, Holdings Channel reports. The institutional investor owned 31,219 shares of the iPhone maker’s stock after selling 876 shares d…",newsapi
75,2025-09-24,Post Resch Tallon Group Inc. Decreases Stake in Apple Inc. $AAPL,"Post Resch Tallon Group Inc. lowered its position in Apple Inc. (NASDAQ:AAPL – Free Report) by 26.0% in the second quarter, according to its most recent Form 13F filing with the Securities & Exchange Commission. The fund owned 5,617 shares of the iPhone maker…",newsapi
76,2025-09-24,Lifelong Wealth Advisors Inc. Acquires 444 Shares of Apple Inc. $AAPL,"Lifelong Wealth Advisors Inc. grew its stake in shares of Apple Inc. (NASDAQ:AAPL – Free Report) by 6.9% during the 2nd quarter, according to its most recent 13F filing with the Securities & Exchange Commission. The fund owned 6,918 shares of the iPhone maker…",newsapi
77,2025-09-24,Lbmc Investment Advisors LLC Sells 463 Shares of Apple Inc. $AAPL,"Lbmc Investment Advisors LLC lowered its position in shares of Apple Inc. (NASDAQ:AAPL – Free Report) by 0.7% in the second quarter, according to the company in its most recent 13F filing with the Securities & Exchange Commission. The fund owned 64,302 shares…",newsapi
78,2025-09-24,Apple Inc. $AAPL is Gateway Investment Advisers LLC’s 3rd Largest Position,"Gateway Investment Advisers LLC trimmed its stake in Apple Inc. (NASDAQ:AAPL – Free Report) by 4.3% in the second quarter, Holdings Channel.com reports. The firm owned 2,694,199 shares of the iPhone maker’s stock after selling 121,204 shares during the quarte…",newsapi
79,2025-09-24,Leibman Financial Services Inc. Has $2.68 Million Stock Holdings in Apple Inc. $AAPL,"Leibman Financial Services Inc. decreased its holdings in shares of Apple Inc. (NASDAQ:AAPL – Free Report) by 9.1% in the 2nd quarter, HoldingsChannel reports. The firm owned 13,061 shares of the iPhone maker’s stock after selling 1,311 shares during the peri…",newsapi
80,2025-09-24,"Aaron Wealth Advisors LLC Acquires 6,843 Shares of Apple Inc. $AAPL","Aaron Wealth Advisors LLC grew its position in shares of Apple Inc. (NASDAQ:AAPL – Free Report) by 6.4% in the 2nd quarter, HoldingsChannel.com reports. The fund owned 113,152 shares of the iPhone maker’s stock after purchasing an additional 6,843 shares duri…",newsapi
81,2025-09-24,Apple Inc. $AAPL Shares Sold by Essex Savings Bank,"Essex Savings Bank decreased its position in Apple Inc. (NASDAQ:AAPL – Free Report) by 2.0% in the second quarter, according to its most recent 13F filing with the SEC. The firm owned 111,333 shares of the iPhone maker’s stock after selling 2,257 shares durin…",newsapi
