,date,title,description,source
82,2025-09-24,Logitech、Logi LightChargeテクノロジーによるソーラー充電で駆動するフルサイズキーボード「Signature Slim Solar+ for Mac K980」を発売。,"LogitechがLogi LightChargeによるソーラー充電に対応したキーボード「Signature Slim Solar+ for Mac K980」を発売しています。詳細は以下から。 　スイスLogitec […]
The post Logitech、Logi LightChargeテクノロジーによるソーラー充電で駆動するフルサイズキーボード「Signature Slim Solar+ for Mac K980」を発売。 first appeared on AAPL Ch..",newsapi
83,2025-09-24,Apple Inc. $AAPL Stock Position Cut by Hummer Financial Advisory Services Inc,"Hummer Financial Advisory Services Inc decreased its holdings in shares of Apple Inc. (NASDAQ:AAPL – Free Report) by 4.3% in the 2nd quarter, according to the company in its most recent filing with the Securities and Exchange Commission. The institutional inv…",newsapi
84,2025-09-24,Apple Inc. $AAPL Shares Sold by Berkshire Bank,"Berkshire Bank lessened its holdings in shares of Apple Inc. (NASDAQ:AAPL – Free Report) by 1.4% in the second quarter, Holdings Channel.com reports. The firm owned 79,518 shares of the iPhone maker’s stock after selling 1,148 shares during the period. Apple …",newsapi
85,2025-09-24,Apple (NASDAQ:AAPL) Stock Price Up 4.3% Following Analyst Upgrade,Shares of Apple Inc. (NASDAQ:AAPL – Get Free Report) rose 4.3% during trading on Monday after JPMorgan Chase & Co. raised their price target on the stock from $255.00 to $280.00. JPMorgan Chase & Co. currently has an overweight rating on the stock. Apple trad…,newsapi
86,2025-09-24,Deutsche Bank Gives Synaptics (SYNA) a Buy Rating,"Synaptics Incorporated (NASDAQ:SYNA) is one of the 14 Small Publicly Traded Semiconductor Companies to Invest in Now. On September 11, Deutsche Bank...",newsapi
87,2025-09-24,Best Technology Stocks To Research – September 22nd,"NVIDIA, Apple, Oracle, Palantir Technologies, and Advanced Micro Devices are the five Technology stocks to watch today, according to MarketBeat’s stock screener tool. Technology stocks are shares of companies whose primary business involves the development, m…",newsapi
88,2025-09-24,Skyworks Solutions Stock: Is SWKS Underperforming the Technology Sector?,"Skyworks Solutions has underperformed the technology sector over the past year, and analysts remain cautious about the stock's growth prospects.",newsapi
89,2025-09-23,How to double your ASX share portfolio without chasing risky stocks,"Forget speculation and focus on quality to grow your wealth.
The post How to double your ASX share portfolio without chasing risky stocks appeared first on The Motley Fool Australia.",newsapi
90,2025-09-23,"Stock market today: Dow, S&P 500, Nasdaq slide after Powell flags Fed's challenge, 'highly valued' stocks",Wall Street heard from Chair Jerome Powell for the first time since the Federal Reserve started cutting interest rates again.,newsapi
91,2025-09-23,How to Build the Ultimate Trading Dashboard with Grid Charts,"Track and compare stocks and ETFs across multiple time frames, stack indicators, and more with Grid Charts.",newsapi
92,2025-09-23,"Stock market today: Dow, S&P 500, Nasdaq slide as Powell warns of 'challenging situation'",Wall Street will hear from Chair Jerome Powell for the first time since the Federal Reserve started cutting interest rates again.,newsapi
93,2025-09-23,"Bybit Launches 24/5 Trading for Stock CFDs, Waives Fees Through October",Dubai-based cryptocurrency exchange Bybit has extended trading hours on its TradFi platform for its stock contract for difference (CFD) products. Going...,newsapi
94,2025-09-23,Stocks Lower After Fed Chair Powell Comments,"The S&P 500 Index ($SPX ) (SPY ) today is down -0.62%, the Dow Jones Industrials Index ($DOWI ) (DIA ) is down -0.29%, and the Nasdaq 100 Index ($IUXX ) (QQQ...",newsapi
95,2025-09-23,"Investigating Apple's Standing In Technology Hardware, Storage & Peripherals Industry Compared To Competitors","In today's rapidly changing and highly competitive business world, it is vital for investors and industry enthusiasts to carefully assess companies. In this article, we will perform a comprehensive industry comparison, evaluating Apple AAPL against its key co…",newsapi
96,2025-09-23,Columbia Threadneedle Global Technology Growth Strategy: Apple (AAPL) Faced a Classic Innovator’s Dilemma,"Columbia Threadneedle Investments, an investment management company, released its “Columbia Threadneedle Global Technology Growth Strategy” second-quarter...",newsapi
97,2025-09-23,Here’s What Impacted Apple (AAPL) in Q2,"In its second-quarter 2025 investor letter, Alger Spectra Fund highlighted stocks such as Apple Inc. (NASDAQ:AAPL). Apple Inc. (NASDAQ:AAPL) is an American multinational company that designs, manufactures, and markets smartphones, personal computers, tablets,…",newsapi
98,2025-09-23,Is Google Stock a Buy at New All-Time Highs?,Alphabet just joined the $3 trillion club and hit a new 52-week high. Is it the right time to invest in this tech behemoth?,newsapi
99,2025-09-23,Here’s What Impacted Apple (AAPL) in Q2,"Fred Alger Management, an investment management company, released its “Alger Spectra Fund” second-quarter 2025 investor letter. A copy of the letter can be...",newsapi
